{
  "version": 2,
  "run_id": "20260810120000000000-adapter-pass",
  "project": "/workspace/acme",
  "role": "implement",
  "harness": "codex",
  "model": "gpt-5.6-terra",
  "effort": "medium",
  "source_pool": "claude",
  "source_pool_reference": "1111111111111111111111111111111111111111111111111111111111111111",
  "pool": "codex",
  "pool_reference": "2222222222222222222222222222222222222222222222222222222222222222",
  "capacity_status": "headroom-unverified",
  "policy_fingerprint": "3333333333333333333333333333333333333333333333333333333333333333",
  "resolved_at": "2026-08-10T12:00:01+00:00",
  "triggers_fired": []
}
